{
  "schema_version": "0.1.0",
  "profile_purpose": "stage2_experiment_delimited_smoke_not_flight_calibration",
  "paths": {
    "project_root": "../..",
    "input_root": "../../data/input",
    "response_root": "../../response_campaign/response_library",
    "output_root": "../../runs",
    "log_root": "../../logs"
  },
  "coordinates": {
    "detector_stack_direction": [0.0, 0.0, 1.0],
    "camera_boresight_source_direction": [0.0, 0.0, -1.0]
  },
  "channel_mapping": {
    "chamber_to_channel": {"0": "ch2", "1": "ch1", "2": "ch0"},
    "channel_to_layer": {"ch2": 0, "ch1": 1, "ch0": 2}
  },
  "energy_grid": {
    "minimum_mev": 0.1,
    "maximum_mev": 3.0,
    "bin_width_mev": 0.1
  },
  "sky_grid": {"type": "healpix", "nside": 8, "nested": false},
  "trigger": {
    "required_channels": ["ch1", "ch2"],
    "minimum_hit_energy_mev": {"ch0": 0.0, "ch1": 0.0, "ch2": 0.0},
    "coincidence_window_ns": 5.0
  },
  "runtime": {"numerical_threads_per_worker": 1},
  "batch": {
    "maximum_workers": 5,
    "memory_guard": {
      "enabled": true,
      "minimum_available_gib": 5.0,
      "estimated_worker_peak_gib": 4.0,
      "poll_interval_seconds": 2.0,
      "maximum_retries": 2
    }
  },
  "input": {
    "type": "experiment_delimited",
    "dataset_id": "stage2_smoke",
    "paths": {
      "ch0": "../../tests/fixtures/experiment/ch0.tsv",
      "ch1": "../../tests/fixtures/experiment/ch1.tsv",
      "ch2": "../../tests/fixtures/experiment/ch2.tsv"
    },
    "delimiter": "\t",
    "energy_mode": "direct_mev",
    "columns": {
      "event_id": "EventID",
      "pixel_id": "PixelID",
      "energy_mev": "Energy_MeV",
      "adc": null,
      "x_mm": "X_mm",
      "y_mm": "Y_mm",
      "z_mm": "Z_mm",
      "time_ns": "Time_ns"
    }
  }
}

